{
  "thema": "Robotik (FIKTIVES BEISPIEL)",
  "datum": "2026-09-18",
  "schaetzungen": [
    {
      "herausgeber": "Beispiel Research",
      "jahr_prognose": 2030,
      "marktgroesse": {
        "wert": 120,
        "einheit": "Mrd USD",
        "typ": "berichtet",
        "quelle": "https://example.com/beispiel-research/robotik",
        "abgerufen": "2026-09-18",
        "jahr": 2030,
        "herausgeber": "Beispiel Research"
      },
      "cagr": {
        "wert": 14.2,
        "einheit": "%",
        "typ": "berichtet",
        "quelle": "https://example.com/beispiel-research/robotik",
        "abgerufen": "2026-09-18"
      },
      "abgrenzung": "Industrie- und Serviceroboter inkl. Software, ohne Drohnen"
    },
    {
      "herausgeber": "Fiktiver Branchenverband e. V.",
      "jahr_prognose": 2030,
      "marktgroesse": {
        "wert": 85,
        "einheit": "Mrd USD",
        "typ": "berichtet",
        "quelle": "https://example.com/verband/statistik",
        "abgerufen": "2026-09-18",
        "jahr": 2030
      },
      "abgrenzung": "nur Industrieroboter (Hardware)"
    },
    {
      "herausgeber": "Muster Analytics",
      "jahr_prognose": 2032,
      "marktgroesse": {
        "wert": 210,
        "einheit": "Mrd USD",
        "typ": "schaetzung",
        "begruendung": "Hochrechnung aus dem Basisjahr 2025 mit der vom Herausgeber genannten Wachstumsrate von 18 % p. a.; Methodik nicht offengelegt.",
        "abgerufen": "2026-09-18",
        "jahr": 2032
      },
      "abgrenzung": "breite Abgrenzung inkl. humanoider Roboter und Komponenten"
    }
  ],
  "treiber": [
    {
      "titel": "Fachkräftemangel",
      "beschreibung": "Fachkräftemangel – fiktive Beschreibung für Testzwecke.",
      "belege": [
        {
          "aussage": "Beleg zu Fachkräftemangel",
          "quelle": "https://example.com/beleg"
        },
        {
          "wert": 3.1,
          "einheit": "%",
          "typ": "berichtet",
          "quelle": "https://example.com/statistik",
          "abgerufen": "2026-09-18"
        }
      ]
    },
    {
      "titel": "Sinkende Sensorkosten",
      "beschreibung": "Sinkende Sensorkosten – fiktive Beschreibung für Testzwecke.",
      "belege": [
        {
          "aussage": "Beleg zu Sinkende Sensorkosten",
          "quelle": "https://example.com/beleg"
        },
        {
          "wert": 3.1,
          "einheit": "%",
          "typ": "berichtet",
          "quelle": "https://example.com/statistik",
          "abgerufen": "2026-09-18"
        }
      ]
    },
    {
      "titel": "KI-Steuerung",
      "beschreibung": "KI-Steuerung – fiktive Beschreibung für Testzwecke.",
      "belege": [
        {
          "aussage": "Beleg zu KI-Steuerung",
          "quelle": "https://example.com/beleg"
        },
        {
          "wert": 3.1,
          "einheit": "%",
          "typ": "berichtet",
          "quelle": "https://example.com/statistik",
          "abgerufen": "2026-09-18"
        }
      ]
    }
  ],
  "huerden": [
    {
      "titel": "Hohe Anfangsinvestition",
      "beschreibung": "Hohe Anfangsinvestition – fiktive Beschreibung für Testzwecke.",
      "belege": [
        {
          "aussage": "Beleg zu Hohe Anfangsinvestition",
          "quelle": "https://example.com/beleg"
        },
        {
          "wert": 3.1,
          "einheit": "%",
          "typ": "berichtet",
          "quelle": "https://example.com/statistik",
          "abgerufen": "2026-09-18"
        }
      ]
    },
    {
      "titel": "Integrationsaufwand",
      "beschreibung": "Integrationsaufwand – fiktive Beschreibung für Testzwecke.",
      "belege": [
        {
          "aussage": "Beleg zu Integrationsaufwand",
          "quelle": "https://example.com/beleg"
        },
        {
          "wert": 3.1,
          "einheit": "%",
          "typ": "berichtet",
          "quelle": "https://example.com/statistik",
          "abgerufen": "2026-09-18"
        }
      ]
    },
    {
      "titel": "Regulierung",
      "beschreibung": "Regulierung – fiktive Beschreibung für Testzwecke.",
      "belege": [
        {
          "aussage": "Beleg zu Regulierung",
          "quelle": "https://example.com/beleg"
        },
        {
          "wert": 3.1,
          "einheit": "%",
          "typ": "berichtet",
          "quelle": "https://example.com/statistik",
          "abgerufen": "2026-09-18"
        }
      ]
    }
  ],
  "segmente": [
    {
      "id": "sensorik",
      "name": "Sensorik",
      "beschreibung": "Segment Sensorik (fiktiv).",
      "margenprofil": {
        "stufe": "hoch",
        "begruendung": "Fiktive Begründung: Preissetzungsmacht durch Spezialisierung."
      },
      "kandidaten": [
        {
          "name": "Beispiel Sensorik AG 1",
          "ticker": "BSP11.DE",
          "begruendung": "fiktiver Kandidat"
        },
        {
          "name": "Beispiel Sensorik AG 2",
          "ticker": "BSP12.DE",
          "begruendung": "fiktiver Kandidat"
        },
        {
          "name": "Beispiel Sensorik AG 3",
          "ticker": "BSP13.DE",
          "begruendung": "fiktiver Kandidat"
        }
      ],
      "marktgroesse": {
        "wert": 9,
        "einheit": "Mrd USD",
        "typ": "schaetzung",
        "begruendung": "Anteil von rund 10 % an der mittleren Marktschätzung, analog zu Kostenstrukturen typischer Roboterarme.",
        "abgerufen": "2026-09-18"
      }
    },
    {
      "id": "antriebe",
      "name": "Antriebe",
      "beschreibung": "Segment Antriebe (fiktiv).",
      "margenprofil": {
        "stufe": "mittel",
        "begruendung": "Fiktive Begründung: Preissetzungsmacht durch Spezialisierung."
      },
      "kandidaten": [
        {
          "name": "Beispiel Antriebe AG 1",
          "ticker": "BSP21.DE",
          "begruendung": "fiktiver Kandidat"
        },
        {
          "name": "Beispiel Antriebe AG 2",
          "ticker": "BSP22.DE",
          "begruendung": "fiktiver Kandidat"
        },
        {
          "name": "Beispiel Antriebe AG 3",
          "ticker": "BSP23.DE",
          "begruendung": "fiktiver Kandidat"
        }
      ]
    },
    {
      "id": "steuerungssoftware",
      "name": "Steuerungssoftware",
      "beschreibung": "Segment Steuerungssoftware (fiktiv).",
      "margenprofil": {
        "stufe": "hoch",
        "begruendung": "Fiktive Begründung: Preissetzungsmacht durch Spezialisierung."
      },
      "kandidaten": [
        {
          "name": "Beispiel Steuerungssoftware AG 1",
          "ticker": "BSP31.DE",
          "begruendung": "fiktiver Kandidat"
        },
        {
          "name": "Beispiel Steuerungssoftware AG 2",
          "ticker": "BSP32.DE",
          "begruendung": "fiktiver Kandidat"
        },
        {
          "name": "Beispiel Steuerungssoftware AG 3",
          "ticker": "BSP33.DE",
          "begruendung": "fiktiver Kandidat"
        }
      ]
    },
    {
      "id": "systemintegration",
      "name": "Systemintegration",
      "beschreibung": "Segment Systemintegration (fiktiv).",
      "margenprofil": {
        "stufe": "niedrig",
        "begruendung": "Fiktive Begründung: Preissetzungsmacht durch Spezialisierung."
      },
      "kandidaten": [
        {
          "name": "Beispiel Systemintegration AG 1",
          "ticker": "BSP41.DE",
          "begruendung": "fiktiver Kandidat"
        },
        {
          "name": "Beispiel Systemintegration AG 2",
          "ticker": "BSP42.DE",
          "begruendung": "fiktiver Kandidat"
        },
        {
          "name": "Beispiel Systemintegration AG 3",
          "ticker": "BSP43.DE",
          "begruendung": "fiktiver Kandidat"
        }
      ]
    },
    {
      "id": "komplettroboter",
      "name": "Komplettroboter",
      "beschreibung": "Segment Komplettroboter (fiktiv).",
      "margenprofil": {
        "stufe": "mittel",
        "begruendung": "Fiktive Begründung: Preissetzungsmacht durch Spezialisierung."
      },
      "kandidaten": [
        {
          "name": "Beispiel Komplettroboter AG 1",
          "ticker": "BSP51.DE",
          "begruendung": "fiktiver Kandidat"
        },
        {
          "name": "Beispiel Komplettroboter AG 2",
          "ticker": "BSP52.DE",
          "begruendung": "fiktiver Kandidat"
        },
        {
          "name": "Beispiel Komplettroboter AG 3",
          "ticker": "BSP53.DE",
          "begruendung": "fiktiver Kandidat"
        }
      ]
    }
  ]
}
